<?xml version = "1.0" encoding = "UTF-8" standalone = "no"?>
<!DOCTYPE BossList SYSTEM "XBosses.dtd" [
	<!ENTITY AbstractBosses	SYSTEM "XAbstractBosses.xml">
]>

<!-- This file includes sample boss layouts for all the UI objects. You
     can use these bosses as is or you can create your own bosses if you 
     need to customize the bosses or if you're concerned about code bloat. -->

<BossList>
	&AbstractBosses;

<!-- Extensions (these are just for reference: you'll never actually inherit from one of these bosses) -->
	<AbstractBoss name = "MouseExtensions">				
		<Group>
			<Interface name = "IClickExtension, IMenuCommandClickExtension" impl = "XMenuCommandClickExtension"/>
			<Interface name = "IClickExtension, ICommandClickExtension" impl = "XCommandClickExtension"/>
			<Interface name = "IClickExtension, ICallbackClickExtension" impl = "XCallbackClickExtension"/>
		</Group>
	</AbstractBoss>

	<AbstractBoss name = "DrawExtensions">				
		<Group>
			<Interface name = "IDrawExtension, IFillExtension"   impl = "XEraseExtension"/>
			<Interface name = "IDrawExtension, IStrokeExtension" impl = "XLineLeftExtension"/>
			<Interface name = "IDrawExtension, IStrokeExtension" impl = "XLineRightExtension"/>
			<Interface name = "IDrawExtension, IStrokeExtension" impl = "XLineTopExtension"/>
			<Interface name = "IDrawExtension, IStrokeExtension" impl = "XLineBottomExtension"/>
			<Interface name = "IDrawExtension, IStrokeExtension" impl = "XFrameExtension"/>
			<Interface name = "IDrawExtension, IStrokeExtension" impl = "XShadowedFrameExtension"/>
		</Group>
	</AbstractBoss>

<!-- Application -->
	<Boss name = "Optional Application Interfaces">			
		<Interface name = "IStringTableLoader" impl = "XStringTableLoader"/>				
		<Interface name = "IMenuBar" impl = "MenuBar" platform = "mac"/>
		<Interface name = "IActiveMenuBar" impl = "XActiveMenuBar"/>
		<Interface name = "IIdler" impl = "XIdler"/>				
		<Interface name = "ITimer" impl = "XTimer"/>
		<Interface name = "IXMLMenu" impl = "XXMLMenu"/>			

		<Interface name = "ICommandQueue" impl = "XCommandQueue"/>

		<Interface name = "IActiveUndoContext" impl = "XActiveUndoContext"/>
		<Interface name = "IUndoContext" impl = "XUndoContext"/>

		<Interface name = "IMenuExtensible" impl = "XMenuExtensible"/>
		<Interface name = "IKeyExtensible" impl = "XKeyExtensible"/>
	</Boss>

	<Boss name = "Application" singleton = "true">			<!-- must have this name -->		
		<Inherit name = "Base Application"/>
		<Inherit name = "Optional Application Interfaces"/>
	</Boss>

<!-- Persistence -->
	<Boss name = "XML Persist" singleton = "true">			<!-- must have this name -->
		<Interface name = "IPersistXML" impl = "XPersistXML"/>
	</Boss>

<!-- Drag and Drop App Progress Window -->
	<Boss name = "Progress Window">				
		<Inherit name = "Base Window"/>
		<Interface name = "IDropAppProgress" impl = "XDropAppProgress"/>
	</Boss>

<!-- Window -->
	<Boss name = "Optional Window Interfaces">				
		<Interface name = "IKeyHandler" impl = "XWindowKeyHandler"/>						<!-- handles tabbing to next control -->
		<Interface name = "IMouseHandler" impl = "MWindowMouseHandler" platform = "mac"/>	<!-- need this if the window has controls -->
		<Interface name = "IMenuBar" impl = "MMenuBar" platform = "win"/>
		<Interface name = "IUndoContext" impl = "XUndoContext"/>
		
		<Interface name = "IHelpText, ISetHelp" impl = "XDefaultHelp"/>
		<Interface name = "IShowHelp" impl = "MBalloonHelp" platform = "classic_mac"/>

		<Interface name = "IMenuExtensible" impl = "XMenuExtensible"/>
		<Interface name = "IMouseExtensible" impl = "XMouseExtensible"/>
		<Interface name = "IKeyExtensible" impl = "XKeyExtensible"/>
		<Interface name = "IDrawExtensible" impl = "XDrawExtensible"/>
	</Boss>

	<Boss name = "Window">				
		<Inherit name = "Base Window"/>
		<Inherit name = "Optional Window Interfaces"/>
	</Boss>

<!-- Menus -->
	<Boss name = "Menu">					
		<Interface name = "IMenu" impl = "Menu"/>
	</Boss>

	<Boss name = "Context Menu">					
		<Interface name = "IContextMenu" impl = "ContextMenu"/>
		<Interface name = "IMenu" impl = "Menu"/>
	</Boss>

<!-- Commands -->
	<Boss name = "Deferred Menu Command">					
		<Interface name = "ICommand, IDeferredMenuCommand" impl = "XDeferredMenuCommand"/>
	</Boss>

	<Boss name = "Deferred Error Command">					
		<Interface name = "ICommand, IDeferredErrorCommand" impl = "XDeferredErrorCommand"/>
	</Boss>

	<Boss name = "Callback Command">					
		<Interface name = "ICommand, ICallbackCommand" impl = "XCallbackCommand"/>
	</Boss>

<!-- Undo Actions -->
	<Boss name = "Multiple Undo Action">					
		<Interface name = "IUndoAction, IMultipleUndoAction" impl = "XMultipleUndoAction"/>
		<Interface name = "ICommand" impl = "XUndoCommand"/>
	</Boss>

	<Boss name = "Undo Callback Action">					
		<Interface name = "IUndoAction, IUndoCallbackAction" impl = "XUndoCallbackAction"/>
		<Interface name = "ICommand" impl = "XUndoCommand"/>
	</Boss>

<!-- Controls -->
	<AbstractBoss name = "Optional Control Interfaces">							
		<Interface name = "IMouseHandler" impl = "XControlMouseHandler"/>
		<Interface name = "IHelpText, ISetHelp, ISetDisabledHelp" impl = "XControlHelp"/>
		<Interface name = "IShowHelp" impl = "MBalloonHelp" platform = "classic_mac"/>

		<Interface name = "IMouseExtensible" impl = "XMouseExtensible"/>
		<Interface name = "IDrawExtensible" impl = "XDrawExtensible"/>
	</AbstractBoss>

	<Boss name = "Group Control">					
		<Inherit name = "Base Group Control"/>
		<Inherit name = "Optional Control Interfaces"/>
	</Boss>

	<Boss name = "Progress Bar">					
		<Inherit name = "Base Progress Bar"/>
		<Inherit name = "Optional Control Interfaces"/>
	</Boss>

	<Boss name = "Push Button">					
		<Inherit name = "Base Push Button"/>
		<Inherit name = "Optional Control Interfaces"/>
		
		<!-- optional interfaces $$$ move this to checkbox and radio button once they're implemented $$$ -->
		<Interface name = "IHelpText, ISetHelp, ISetDisabledHelp, ISetCheckedHelp" impl = "XButtonHelp"/>
	</Boss>

	<Boss name = "Root Control">					
		<Inherit name = "Base Root Control"/>
		<Inherit name = "Optional Control Interfaces"/>
	</Boss>

	<Boss name = "Scroll Bar">					
		<Inherit name = "Base Scroll Bar"/>
		<Inherit name = "Optional Control Interfaces"/>
	</Boss>

	<AbstractBoss name = "Scrollable Control">					
		<Inherit name = "Base Scrollable Control"/>
		<Inherit name = "Optional Control Interfaces"/>
		
		<!-- optional interfaces -->
		<Interface name = "IKeyExtensible" impl = "XKeyExtensible"/>
	</AbstractBoss>

	<Boss name = "Scroller Control">					
		<Inherit name = "Base Scroller Control"/>
		<Inherit name = "Optional Control Interfaces"/>
	</Boss>

	<Boss name = "Static Text">					
		<Inherit name = "Base Static Text"/>
		<Inherit name = "Optional Control Interfaces"/>
	</Boss>
</BossList>


